{
  "id": "01jrcasebox0000000000000p6",
  "tenant_id": "tenant-local-v1",
  "actor_user_id": "local-user",
  "matter_id": "01jrcasebox0000000000000m1",
  "target_type": "document",
  "target_id": "01jrcasebox0000000000000d5",
  "kind": "attorney_client",
  "basis_text": "Original attorney-client privilege over the engagement letter.",
  "status": "waived",
  "source_type": "lawyer_authored",
  "extractor_name": null,
  "extractor_version": null,
  "extraction_confidence": null,
  "proposed_at": "2026-05-20T14:40:00.000Z",
  "confirmed_actor_user_id": "local-user",
  "confirmed_at": "2026-05-20T14:40:30.000Z",
  "dismissed_actor_user_id": null,
  "dismissed_at": null,
  "dismissal_reason": null,
  "waiver_actor_user_id": "local-user",
  "waived_at": "2026-06-15T09:00:00.000Z",
  "waiver_reason": "Produced in discovery on 2026-06-15 per court order.",
  "created_at": "2026-05-20T14:40:00.000Z"
}
