{
  "id": "01jrcasebox0000000000000p5",
  "tenant_id": "tenant-local-v1",
  "actor_user_id": "local-user",
  "matter_id": "01jrcasebox0000000000000m1",
  "target_type": "document",
  "target_id": "01jrcasebox0000000000000d4",
  "kind": "attorney_client",
  "basis_text": "LLM thought this was a privileged email.",
  "status": "dismissed",
  "source_type": "llm_suggested",
  "extractor_name": "claude-opus-4-7",
  "extractor_version": "2026-05-01",
  "extraction_confidence": 0.32,
  "proposed_at": "2026-05-20T14:30:00.000Z",
  "confirmed_actor_user_id": null,
  "confirmed_at": null,
  "dismissed_actor_user_id": "local-user",
  "dismissed_at": "2026-05-20T14:35:00.000Z",
  "dismissal_reason": "Document is a published court filing; no privilege applies.",
  "waiver_actor_user_id": null,
  "waived_at": null,
  "waiver_reason": null,
  "created_at": "2026-05-20T14:30:00.000Z"
}
