{
  "id": "01jrcasebox0000000000000p2",
  "tenant_id": "tenant-local-v1",
  "actor_user_id": "local-user",
  "matter_id": "01jrcasebox0000000000000m1",
  "target_type": "document",
  "target_id": "01jrcasebox0000000000000d2",
  "kind": "work_product",
  "basis_text": "Internal memo prepared in anticipation of litigation.",
  "status": "proposed",
  "source_type": "lawyer_authored",
  "extractor_name": null,
  "extractor_version": null,
  "extraction_confidence": null,
  "proposed_at": "2026-05-20T14:10:00.000Z",
  "confirmed_actor_user_id": null,
  "confirmed_at": null,
  "dismissed_actor_user_id": null,
  "dismissed_at": null,
  "dismissal_reason": null,
  "waiver_actor_user_id": null,
  "waived_at": null,
  "waiver_reason": null,
  "created_at": "2026-05-20T14:10:00.000Z"
}
