{
  "id": "01jrcasebox0000000000000p4",
  "tenant_id": "tenant-local-v1",
  "actor_user_id": "local-user",
  "matter_id": "01jrcasebox0000000000000m1",
  "target_type": "fact",
  "target_id": "01jrcasebox0000000000000f5",
  "kind": "work_product",
  "basis_text": "Fact derived from attorney mental impressions.",
  "status": "confirmed",
  "source_type": "lawyer_authored",
  "extractor_name": null,
  "extractor_version": null,
  "extraction_confidence": null,
  "proposed_at": "2026-05-20T14:25:00.000Z",
  "confirmed_actor_user_id": "local-user",
  "confirmed_at": "2026-05-20T14:25:30.000Z",
  "dismissed_actor_user_id": null,
  "dismissed_at": null,
  "dismissal_reason": null,
  "waiver_actor_user_id": null,
  "waived_at": null,
  "waiver_reason": null,
  "created_at": "2026-05-20T14:25:00.000Z"
}
