{
  "id": "01jrcasebox0000000000000p1",
  "tenant_id": "tenant-local-v1",
  "actor_user_id": "local-user",
  "matter_id": "01jrcasebox0000000000000m1",
  "target_type": "document",
  "target_id": "01jrcasebox0000000000000d1",
  "kind": "attorney_client",
  "basis_text": "Email between counsel and client discussing litigation strategy.",
  "status": "proposed",
  "source_type": "llm_suggested",
  "extractor_name": "claude-opus-4-7",
  "extractor_version": "2026-05-01",
  "extraction_confidence": 0.78,
  "proposed_at": "2026-05-20T14:00:00.000Z",
  "confirmed_actor_user_id": null,
  "confirmed_at": null,
  "dismissed_actor_user_id": null,
  "dismissed_at": null,
  "dismissal_reason": null,
  "waiver_actor_user_id": null,
  "waived_at": null,
  "waiver_reason": null,
  "created_at": "2026-05-20T14:00:00.000Z"
}
